{
  "success": true,
  "status": {
    "code": 200,
    "message": "Request completed successfully"
  },
  "data": {
    "id": 1
  },
  "meta": {
    "api_version": "v1",
    "service": "auth-service",
    "environment": "local",
    "tenant_id": null,
    "user_id": null,
    "request_id": "req_01J8ZK9",
    "correlation_id": "corr_01J8ZK9",
    "trace_id": null,
    "timestamp": "2026-06-23T17:30:00Z"
  },
  "links": {
    "self": "/api/v1/contact/messages/1"
  }
}
